{
  "files": [
    {
      "kind": "file",
      "owner": "gradient-managed",
      "policy": "update-if-unchanged",
      "source_path": ".agents/agents/beck.md",
      "source_sha256": "e62243327817aa919d1fc6e1f9b50bacf915a977b1cb62b194a7d9933047d883",
      "target_path": ".agents/agents/beck.md",
      "target_sha256": "e62243327817aa919d1fc6e1f9b50bacf915a977b1cb62b194a7d9933047d883"
    },
    {
      "kind": "file",
      "owner": "gradient-managed",
      "policy": "update-if-unchanged",
      "source_path": ".agents/agents/builder.md",
      "source_sha256": "44866cd33025a82492c0265b054e7d9dcb34791ccc402778acdaf154d869176c",
      "target_path": ".agents/agents/builder.md",
      "target_sha256": "44866cd33025a82492c0265b054e7d9dcb34791ccc402778acdaf154d869176c"
    },
    {
      "kind": "file",
      "owner": "gradient-managed",
      "policy": "update-if-unchanged",
      "source_path": ".agents/agents/carmack.md",
      "source_sha256": "a3779a7e2eb3551d1f82d378d88d739ca2c5a2fbffd9ec3b4f235cf8658279cb",
      "target_path": ".agents/agents/carmack.md",
      "target_sha256": "a3779a7e2eb3551d1f82d378d88d739ca2c5a2fbffd9ec3b4f235cf8658279cb"
    },
    {
      "kind": "file",
      "owner": "gradient-managed",
      "policy": "update-if-unchanged",
      "source_path": ".agents/agents/cooper.md",
      "source_sha256": "01b056a4ac5c2702e249063da0d2bd38e6fdf2f02dd7c129d26b8f6b046ecc34",
      "target_path": ".agents/agents/cooper.md",
      "target_sha256": "01b056a4ac5c2702e249063da0d2bd38e6fdf2f02dd7c129d26b8f6b046ecc34"
    },
    {
      "kind": "file",
      "owner": "gradient-managed",
      "policy": "update-if-unchanged",
      "source_path": ".agents/agents/critic.md",
      "source_sha256": "da4f51f631355b445586193edff56ac7435b960d48629bdcb754aed2c9777566",
      "target_path": ".agents/agents/critic.md",
      "target_sha256": "da4f51f631355b445586193edff56ac7435b960d48629bdcb754aed2c9777566"
    },
    {
      "kind": "file",
      "owner": "gradient-managed",
      "policy": "update-if-unchanged",
      "source_path": ".agents/agents/grug.md",
      "source_sha256": "0e4166caa7b103db02e983d8fb9c784b5d617dabe0b8f6d6e3d62787093ddbd7",
      "target_path": ".agents/agents/grug.md",
      "target_sha256": "0e4166caa7b103db02e983d8fb9c784b5d617dabe0b8f6d6e3d62787093ddbd7"
    },
    {
      "kind": "file",
      "owner": "gradient-managed",
      "policy": "update-if-unchanged",
      "source_path": ".agents/agents/ousterhout.md",
      "source_sha256": "39a5f7bb89296cf0fb6fc653b8d40c2c386b33a446659a0b8419f3cf784aa140",
      "target_path": ".agents/agents/ousterhout.md",
      "target_sha256": "39a5f7bb89296cf0fb6fc653b8d40c2c386b33a446659a0b8419f3cf784aa140"
    },
    {
      "kind": "file",
      "owner": "gradient-managed",
      "policy": "update-if-unchanged",
      "source_path": ".agents/agents/planner.md",
      "source_sha256": "8c65b4132a0b31de176f22610d800bcbb19af60e2ceb73f124da2efc173e697e",
      "target_path": ".agents/agents/planner.md",
      "target_sha256": "8c65b4132a0b31de176f22610d800bcbb19af60e2ceb73f124da2efc173e697e"
    },
    {
      "kind": "file",
      "owner": "gradient-managed",
      "policy": "update-if-unchanged",
      "source_path": ".agents/skills/agent-readiness/.spellbook",
      "source_sha256": "e602794196772372cffa397e7b62fbbc52d8782e70b21e7612ca69b4a82d930f",
      "target_path": ".agents/skills/agent-readiness/.spellbook",
      "target_sha256": "e602794196772372cffa397e7b62fbbc52d8782e70b21e7612ca69b4a82d930f"
    },
    {
      "kind": "file",
      "owner": "gradient-managed",
      "policy": "update-if-unchanged",
      "source_path": ".agents/skills/agent-readiness/SKILL.md",
      "source_sha256": "c53af7ec3efbf7ac12b5b92174d89e5432480fb332300378df473b836363fa4f",
      "target_path": ".agents/skills/agent-readiness/SKILL.md",
      "target_sha256": "c53af7ec3efbf7ac12b5b92174d89e5432480fb332300378df473b836363fa4f"
    },
    {
      "kind": "file",
      "owner": "gradient-managed",
      "policy": "update-if-unchanged",
      "source_path": ".agents/skills/agent-readiness/references/agent-readiness-principles.md",
      "source_sha256": "0e6ba040fd8c60614deeea4204cc6fafbbef2de89af6af8fc6cbc984cbd963bf",
      "target_path": ".agents/skills/agent-readiness/references/agent-readiness-principles.md",
      "target_sha256": "0e6ba040fd8c60614deeea4204cc6fafbbef2de89af6af8fc6cbc984cbd963bf"
    },
    {
      "kind": "file",
      "owner": "gradient-managed",
      "policy": "update-if-unchanged",
      "source_path": ".agents/skills/agent-readiness/references/pillar-checks.md",
      "source_sha256": "1e752fb7dc1babfca6ec7045915e013fa27ff8fb03cc328679c46150135c0aec",
      "target_path": ".agents/skills/agent-readiness/references/pillar-checks.md",
      "target_sha256": "1e752fb7dc1babfca6ec7045915e013fa27ff8fb03cc328679c46150135c0aec"
    },
    {
      "kind": "file",
      "owner": "gradient-managed",
      "policy": "update-if-unchanged",
      "source_path": ".agents/skills/ceo-review/.spellbook",
      "source_sha256": "e4f3bb04b9e7bfafc3463941f90d17f09aa28aadccf972c08623dbc67401a911",
      "target_path": ".agents/skills/ceo-review/.spellbook",
      "target_sha256": "e4f3bb04b9e7bfafc3463941f90d17f09aa28aadccf972c08623dbc67401a911"
    },
    {
      "kind": "file",
      "owner": "gradient-managed",
      "policy": "update-if-unchanged",
      "source_path": ".agents/skills/ceo-review/SKILL.md",
      "source_sha256": "c39fbd579af7df81c78d9c4f545e4ff8daeef671db5efea60a417e8a2fd518f2",
      "target_path": ".agents/skills/ceo-review/SKILL.md",
      "target_sha256": "c39fbd579af7df81c78d9c4f545e4ff8daeef671db5efea60a417e8a2fd518f2"
    },
    {
      "kind": "file",
      "owner": "gradient-managed",
      "policy": "update-if-unchanged",
      "source_path": ".agents/skills/ci/.spellbook",
      "source_sha256": "2d5bf73fde5d6bc1b165201341f26b46d2640d688c20124ee82a30271df3aac5",
      "target_path": ".agents/skills/ci/.spellbook",
      "target_sha256": "2d5bf73fde5d6bc1b165201341f26b46d2640d688c20124ee82a30271df3aac5"
    },
    {
      "kind": "file",
      "owner": "gradient-managed",
      "policy": "update-if-unchanged",
      "source_path": ".agents/skills/ci/SKILL.md",
      "source_sha256": "73bfd2a320a8614f0041deba73ef8f9a73ed2aab7284649c59182cbc286c6724",
      "target_path": ".agents/skills/ci/SKILL.md",
      "target_sha256": "73bfd2a320a8614f0041deba73ef8f9a73ed2aab7284649c59182cbc286c6724"
    },
    {
      "kind": "file",
      "owner": "gradient-managed",
      "policy": "update-if-unchanged",
      "source_path": ".agents/skills/ci/references/audit.md",
      "source_sha256": "195fec3a1382b6c6c7c4fba1363791b5bf3118fd82b6deae6ead0f5f20009063",
      "target_path": ".agents/skills/ci/references/audit.md",
      "target_sha256": "195fec3a1382b6c6c7c4fba1363791b5bf3118fd82b6deae6ead0f5f20009063"
    },
    {
      "kind": "file",
      "owner": "gradient-managed",
      "policy": "update-if-unchanged",
      "source_path": ".agents/skills/ci/references/self-heal.md",
      "source_sha256": "80e231be12b036eb585d53b5e6f12e4123742158164de33bc1e32177fbfb8545",
      "target_path": ".agents/skills/ci/references/self-heal.md",
      "target_sha256": "80e231be12b036eb585d53b5e6f12e4123742158164de33bc1e32177fbfb8545"
    },
    {
      "kind": "file",
      "owner": "gradient-managed",
      "policy": "update-if-unchanged",
      "source_path": ".agents/skills/code-review/.spellbook",
      "source_sha256": "09f3b7ae72077e5af7e8db8af5241e958e111061d597dd88620be341260d74a3",
      "target_path": ".agents/skills/code-review/.spellbook",
      "target_sha256": "09f3b7ae72077e5af7e8db8af5241e958e111061d597dd88620be341260d74a3"
    },
    {
      "kind": "file",
      "owner": "gradient-managed",
      "policy": "update-if-unchanged",
      "source_path": ".agents/skills/code-review/SKILL.md",
      "source_sha256": "dbbb95df491805e87ca6e15193407293eef422b64c0cdc57cadc6c540a34d3b3",
      "target_path": ".agents/skills/code-review/SKILL.md",
      "target_sha256": "dbbb95df491805e87ca6e15193407293eef422b64c0cdc57cadc6c540a34d3b3"
    },
    {
      "kind": "file",
      "owner": "gradient-managed",
      "policy": "update-if-unchanged",
      "source_path": ".agents/skills/code-review/evals/README.md",
      "source_sha256": "260f4fba614c096d578dff4e5f7faab3ca1806fec918274e794087bda636084b",
      "target_path": ".agents/skills/code-review/evals/README.md",
      "target_sha256": "260f4fba614c096d578dff4e5f7faab3ca1806fec918274e794087bda636084b"
    },
    {
      "kind": "file",
      "owner": "gradient-managed",
      "policy": "update-if-unchanged",
      "source_path": ".agents/skills/code-review/evals/cases/unverified-entrypoint.md",
      "source_sha256": "f9049a1855fe46dd3308f86e95b0775e6eb104410b63a323ec90b7148dc0e654",
      "target_path": ".agents/skills/code-review/evals/cases/unverified-entrypoint.md",
      "target_sha256": "f9049a1855fe46dd3308f86e95b0775e6eb104410b63a323ec90b7148dc0e654"
    },
    {
      "kind": "file",
      "owner": "gradient-managed",
      "policy": "update-if-unchanged",
      "source_path": ".agents/skills/code-review/evals/graders/check.sh",
      "source_sha256": "4dbde5774ce7fd490ecb6949925fc4b17e18624b1074bd8d1b9026d130fec716",
      "target_path": ".agents/skills/code-review/evals/graders/check.sh",
      "target_sha256": "4dbde5774ce7fd490ecb6949925fc4b17e18624b1074bd8d1b9026d130fec716"
    },
    {
      "kind": "file",
      "owner": "gradient-managed",
      "policy": "update-if-unchanged",
      "source_path": ".agents/skills/code-review/references/bench-map.md",
      "source_sha256": "f1af34787e14dadb6378aae5827fb0d5c81f49c1bcc9bc0463dcbfb876b525e4",
      "target_path": ".agents/skills/code-review/references/bench-map.md",
      "target_sha256": "f1af34787e14dadb6378aae5827fb0d5c81f49c1bcc9bc0463dcbfb876b525e4"
    },
    {
      "kind": "file",